{
  "schemaVersion" : "matching.m12.state-equivalence.v1",
  "status" : "PASS",
  "implementation" : "REAL_AERON_CHILD_PROCESSES",
  "applicationObserver" : true,
  "memberCount" : 3,
  "nextApplicationSequence" : 67,
  "identityCount" : 66,
  "semanticStateDigest" : "a94bccba4baee2339ddaf525c4251c051f7ad3e48021fd50ceb2ed59f4ffe4df",
  "expectedSemanticStateDigest" : "a94bccba4baee2339ddaf525c4251c051f7ad3e48021fd50ceb2ed59f4ffe4df",
  "identityResultDigest" : "139efc2b815dc044a71ad05d40fea12c071943e6955f1f1702b29b80aa40e73e",
  "expectedIdentityResultDigest" : "139efc2b815dc044a71ad05d40fea12c071943e6955f1f1702b29b80aa40e73e",
  "allMembersIdentityResultDigestMatchDirectOracle" : true,
  "allMembersIdentityCountExact" : true,
  "commitPosition" : 25056,
  "logPosition" : 25056,
  "stateEquivalent" : true,
  "componentErrorCount" : 0,
  "diagnosticWarningCount" : 2,
  "droppedDiagnosticWarnings" : 0,
  "members" : [ {
    "memberId" : 0,
    "processId" : 38707,
    "role" : "LEADER",
    "electionState" : "CLOSED",
    "leadershipTermId" : 2,
    "commitPosition" : 25056,
    "logPosition" : 25056,
    "nextApplicationSequence" : 67,
    "identityCount" : 66,
    "semanticStateDigest" : "a94bccba4baee2339ddaf525c4251c051f7ad3e48021fd50ceb2ed59f4ffe4df",
    "identityResultDigest" : "139efc2b815dc044a71ad05d40fea12c071943e6955f1f1702b29b80aa40e73e",
    "componentErrorCount" : 0,
    "diagnosticWarningCount" : 2,
    "droppedDiagnosticWarnings" : 0,
    "diagnosticWarnings" : [ "io.aeron.cluster.client.ClusterEvent: WARN - leader heartbeat timeout", "io.aeron.cluster.client.ClusterEvent: WARN - inactive follower quorum" ]
  }, {
    "memberId" : 1,
    "processId" : 38711,
    "role" : "FOLLOWER",
    "electionState" : "CLOSED",
    "leadershipTermId" : 2,
    "commitPosition" : 25056,
    "logPosition" : 25056,
    "nextApplicationSequence" : 67,
    "identityCount" : 66,
    "semanticStateDigest" : "a94bccba4baee2339ddaf525c4251c051f7ad3e48021fd50ceb2ed59f4ffe4df",
    "identityResultDigest" : "139efc2b815dc044a71ad05d40fea12c071943e6955f1f1702b29b80aa40e73e",
    "componentErrorCount" : 0,
    "diagnosticWarningCount" : 0,
    "droppedDiagnosticWarnings" : 0,
    "diagnosticWarnings" : [ ]
  }, {
    "memberId" : 2,
    "processId" : 38712,
    "role" : "FOLLOWER",
    "electionState" : "CLOSED",
    "leadershipTermId" : 2,
    "commitPosition" : 25056,
    "logPosition" : 25056,
    "nextApplicationSequence" : 67,
    "identityCount" : 66,
    "semanticStateDigest" : "a94bccba4baee2339ddaf525c4251c051f7ad3e48021fd50ceb2ed59f4ffe4df",
    "identityResultDigest" : "139efc2b815dc044a71ad05d40fea12c071943e6955f1f1702b29b80aa40e73e",
    "componentErrorCount" : 0,
    "diagnosticWarningCount" : 0,
    "droppedDiagnosticWarnings" : 0,
    "diagnosticWarnings" : [ ]
  } ]
}
